{
  "vct": "eu.we-build.control.1",
  "iss": "https://issuer.example.com",
  "iat": 1736935200,
  "exp": 1768471200,
  "issuing_entity": "did:example:company-456",
  "attestation_legal_category": "EAA",
  "schema_version": "0.3.0",
  "trust_anchor_url": "https://trust.webuildconsortium.eu/anchors/eidas-tl",

  "controller": [
    {
      "type": "NP",
      "natural_person": {
        "first_name": "Alice",
        "surname": "Smith",
        "date_of_birth": "1975-03-20"
      },
      "address": {
        "street": "Hauptstrasse",
        "house_number": "10",
        "locality": "Berlin",
        "region": "Berlin",
        "postal_code": "10115",
        "country": "DE"
      },
      "control": [
        {
          "legal_identifier": "DE1234.HRB56789",
          "type": "direct",
          "voting_rights": 60.0,
          "mechanism": [
            "board",
            "contractual"
          ]
        }
      ]
    },
    {
      "type": "NP",
      "natural_person": {
        "first_name": "Klaus",
        "surname": "Müller",
        "date_of_birth": "1968-07-14"
      },
      "address": {
        "street": "Schillerstraße",
        "house_number": "22",
        "locality": "Frankfurt",
        "region": "Hesse",
        "postal_code": "60313",
        "country": "DE"
      },
      "control": [
        {
          "legal_identifier": "DE1234.HRB56789",
          "type": "direct",
          "voting_rights": null,
          "mechanism": [
            "veto",
            "profit_distribution"
          ]
        }
      ]
    },
    {
      "type": "LE",
      "legal_person": {
        "legal_name": "HoldCo GmbH",
        "legal_form": "GmbH",
        "identifier": {
          "euid": "DE9876.HRB54321",
          "lei": "529900T8BM49AURSDO55",
          "tax": "DE123456789"
        }
      },
      "address": {
        "street": "Berliner Allee",
        "house_number": "5",
        "locality": "Düsseldorf",
        "region": "Nordrhein-Westfalen",
        "postal_code": "40213",
        "country": "DE"
      },
      "control": [
        {
          "legal_identifier": "DE1234.HRB56789",
          "type": "indirect",
          "voting_rights": 40.0,
          "mechanism": [
            "nominee"
          ]
        }
      ]
    }
  ],

  "evidence": [
    {
      "evidence_id": "urn:uuid:7a3f9c10-b2e1-41d8-9f7a-112233445566",
      "evidence_type": "Evidence",
      "evidence_data": "JVBERi0xLjQKJcOkw7zDtsOfCjIgMCBvYmoKPDwvTGVuZ3RoIDMgMCBSL0ZpbHRlci9GbGF0ZURlY29kZT4+CnN0cmVhbQp4nCvkMlAwUDC1NNUzMVcozy/KSVUIAP//AAAA//8=",
      "evidence_confirmation": true,
      "evidence_date": "2025-01-20"
    }
  ],
  "status": {
    "type": "status-list",
    "status_list_credential": "https://issuer.example.com/status/control/2025",
    "status_list_index": 456,
    "status_purpose": "revocation"
  },

  "cnf": {
    "jwk": {
      "kty": "EC",
      "crv": "P-256",
      "x": "TCAER19Zvu3OHF4j4W4vfSVoHIP1ILilDls7vCeGemc",
      "y": "ZxjiWWbZMQGHVWKVQ4hbSIirsVfuecCE6t4jT9F2HZQ"
    }
  }
}